{
  "id": "ic3d",
  "name": "IC3D, Inc. (IC3D Printers)",
  "status": "researched",
  "summary": "Central Ohio manufacturer founded in 2012, vertically integrated across \"machines, materials, and manufacturing\": it extrudes its own filament in-house and also designs and builds its own industrial FDM printers (Virago series, up to 4 cubic feet of build volume). Also sells production-focused additive manufacturing and contract manufacturing services.",
  "headquarters_country": "United States",
  "manufacturing_countries": [
    "United States"
  ],
  "brands": [
    "IC3D",
    "IC3D Printers",
    "Virago"
  ],
  "endpoints": {
    "website": "https://www.ic3dprinters.com/",
    "store": "https://www.ic3dprinters.com/shop/pla-filaments/",
    "docs": "https://www.ic3dprinters.com/about-us/",
    "social": {
      "instagram": "https://www.instagram.com/ic3d_printers/",
      "facebook": "https://www.facebook.com/ic3dprinters/",
      "x": "https://x.com/ic3d_printers",
      "linkedin": "https://www.linkedin.com/company/ic3d-printers"
    }
  },
  "product_lines": [
    {
      "name": "PLA",
      "filament_ids": [
        "pla"
      ],
      "notes": "Standard PLA line."
    },
    {
      "name": "Impact Modified PLA",
      "filament_ids": [
        "pla-plus"
      ],
      "notes": "NatureWorks 4043D PLA + undisclosed impact modifier; density 1.24 g/cm3."
    },
    {
      "name": "Matte Impact Modified PLA",
      "filament_ids": [
        "pla-plus",
        "pla-matte"
      ],
      "notes": "Impact-modified PLA with an added matting agent."
    },
    {
      "name": "PETG (standard / Recycled / UV-PETG)",
      "filament_ids": [
        "petg"
      ],
      "notes": "Standard copolyester PETG, a recycled-content grade and a UV-resistant pigmented variant."
    },
    {
      "name": "Matte Recycled PETG",
      "filament_ids": [
        "petg"
      ],
      "notes": "Recycled PETG plus a matting additive; the catalog has no petg-matte id."
    },
    {
      "name": "Carbon Fiber PETG (CF-PETG)",
      "filament_ids": [
        "petg-cf"
      ],
      "notes": "PETG + carbon fibre."
    },
    {
      "name": "PolyHex (HT PETG)",
      "filament_ids": [],
      "notes": "Next-generation copolyester developed with the US Army as a PC replacement: Tg 110 C, HDT 90 C at 66 psi, density 1.18 g/cm3 — far above standard PETG (~80 C Tg, ~65-70 C HDT). Closest analogue is a high-heat PCTG-class copolyester, but it matches neither petg nor pctg cleanly."
    },
    {
      "name": "ABS",
      "filament_ids": [
        "abs"
      ],
      "notes": "Standard ABS line."
    },
    {
      "name": "Nylon",
      "filament_ids": [
        "pa"
      ],
      "notes": "Listed in category navigation but the product page errored at time of research; PA type unconfirmed and the line may be discontinued. Flagged for follow-up."
    },
    {
      "name": "TPE-SEBS-95A",
      "filament_ids": [
        "tpe"
      ],
      "notes": "Explicitly a styrenic block copolymer (SEBS) thermoplastic elastomer, not TPU. Shore 95A, i.e. firmer than the 85A TPU flexibles."
    }
  ],
  "price_tier": "mid",
  "additional_notes": "Legal entity IC3D, Inc. trading as IC3D Printers; manufacturing and HQ in the Columbus/Hilliard area of central Ohio. Filament in 1.75 mm and 2.85 mm. Nylon, PC, PVA and HIPS are not confirmed in the current catalog. IC3D offers contract manufacturing, so it may act as an OEM/co-packer for third parties, but no client brand was named in the research — no oem_relationships row is recorded rather than inventing a counterparty. Positioning is mid-to-premium/industrial (production users rather than hobbyist budget buyers) and typical USD/kg was not sourced, so price_tier \"mid\" is a soft placement. Build plates were not confirmed either way — the hardware business sells whole industrial printers, not print surfaces — so makes_plates is left unset. The dual hardware + material vertical integration is unusual among US filament makers.",
  "provenance": {
    "sources": [
      "https://www.ic3dprinters.com/about-us/",
      "https://www.ic3dprinters.com/shop/pla-filaments/",
      "https://www.instagram.com/ic3d_printers/",
      "https://columbusunderground.com/3d-printers/",
      "https://www.ic3dprinters.com/shop/impact-modified-pla/",
      "https://www.ic3dprinters.com/shop/polyhex/",
      "https://www.ic3dprinters.com/ic3d/wp-content/uploads/2022/02/TPE-SEBS-95A_IC3D_TDS_2022.02.pdf",
      "https://www.ic3dprinters.com/product-category/filament/nylon/",
      "https://www.ic3dprinters.com/shop/"
    ],
    "last_verified": "2026-07-31",
    "confidence": "medium",
    "conflicts": "IC3D confirms it offers contract manufacturing but names no client brands, so any white-label output it produces is invisible in this entry. Price tier is unsourced positioning rather than observed pricing."
  }
}
