{
  "id": "hatchbox",
  "name": "HATCHBOX 3D (Hatchbox Inc.)",
  "status": "researched",
  "summary": "Long-running Amazon-first US filament label, trading since at least 2014 (HB HATCHBOX trademarks filed 2014/2015). Hatchbox is a brand/importer rather than a factory: standard lines have historically been described as Chinese-manufactured, while the separate PLA MAX line is marketed as USA-made. No specific OEM has been confirmed.",
  "headquarters_country": "United States",
  "manufacturing_countries": [
    "China",
    "United States"
  ],
  "brands": [
    "HATCHBOX 3D",
    "PLA MAX",
    "Reload Series"
  ],
  "oem_relationships": [],
  "endpoints": {
    "website": "https://www.hatchbox3d.com/",
    "social": {
      "instagram": "https://www.instagram.com/hatchbox3d/",
      "facebook": "https://www.facebook.com/HATCHBOX3D",
      "youtube": "https://www.youtube.com/channel/UCoUNYur501cAOpQLuX_FFwQ"
    }
  },
  "product_lines": [
    {
      "name": "PLA",
      "filament_ids": [
        "pla"
      ],
      "notes": "SDS describes a 'biodegradable polymer-blend based on polylactic acid' (CAS 9051-89-2), i.e. a PLA blend rather than confirmed neat PLA. Core 1 kg line; 1 kg black listed at $21.99."
    },
    {
      "name": "PLA PRO+",
      "filament_ids": [
        "pla-plus"
      ],
      "notes": "Enhanced-performance/toughened PLA line sitting above base PLA."
    },
    {
      "name": "PLA MAX",
      "filament_ids": [
        "pla"
      ],
      "notes": "'USA Made' premium PLA line. Marketed as premium and biobased but no impact-modifier claim is published, so it is not mapped to pla-plus."
    },
    {
      "name": "PLA CF (Carbon Fiber)",
      "filament_ids": [
        "pla-cf"
      ],
      "notes": "Carbon-fibre-filled PLA; fibre loading not published."
    },
    {
      "name": "Matte PLA",
      "filament_ids": [
        "pla-matte"
      ],
      "notes": "PLA with matting agent."
    },
    {
      "name": "Silk PLA",
      "filament_ids": [
        "pla-silk"
      ],
      "notes": "Silk-luster additive PLA."
    },
    {
      "name": "Metallic Finish PLA (PLA Metal)",
      "filament_ids": [
        "pla"
      ],
      "notes": "Metallic-sheen pigmented PLA with no confirmed metal-powder loading, so it is deliberately NOT mapped to pla-metal (which covers genuinely metal-filled grades)."
    },
    {
      "name": "Transparent PLA",
      "filament_ids": [
        "pla"
      ],
      "notes": "Clear/uncoloured base PLA."
    },
    {
      "name": "UV Color Changing PLA",
      "filament_ids": [
        "pla"
      ],
      "notes": "Photochromic-pigment PLA; base resin is PLA and the catalog has no photochromic id (see gaps)."
    },
    {
      "name": "Wood PLA",
      "filament_ids": [
        "pla-wood"
      ],
      "notes": "'Blending a mixture of plant-based materials and polymers' - PLA plus wood fibre. Wood percentage not published; no heated bed required."
    },
    {
      "name": "Glow PLA",
      "filament_ids": [
        "pla-glow"
      ],
      "notes": "Phosphorescent pigment in a PLA base."
    },
    {
      "name": "Glow ABS",
      "filament_ids": [
        "abs"
      ],
      "notes": "Phosphorescent pigment in an ABS base. Maps to abs only; the catalog has no glow-in-the-dark ABS id (see gaps)."
    },
    {
      "name": "ABS",
      "filament_ids": [
        "abs"
      ],
      "notes": "Standard ABS per SDS."
    },
    {
      "name": "PETG",
      "filament_ids": [
        "petg"
      ],
      "notes": "Standard PETG per SDS."
    },
    {
      "name": "TPU",
      "filament_ids": [
        "tpu",
        "tpu-95a"
      ],
      "notes": "Shore 95A confirmed across all colourway listings, so the tpu-95a grade id applies as well as base tpu."
    },
    {
      "name": "Reload Series",
      "notes": "Spoolless refill packaging of the base chemistries above; no distinct resin, and the exact set of chemistries offered spoolless is not enumerated, so no filament_ids are asserted."
    },
    {
      "name": "Cleaning Filament",
      "notes": "Abrasive purge/nozzle-cleaning compound, not a structural build material; base polymer not specified and no catalog id applies."
    }
  ],
  "price_tier": "mid",
  "additional_notes": "Corporate address is not published on the official site and did not surface in trademark records beyond the owner name Hatchbox Inc.; US base is inferred from Amazon/US retail presence and from the 'USA Made' line being marketed as a distinct exception. Manufacturing origin for standard lines rests on a 2018 retailer account (Printed Solid) describing Hatchbox as 'a Chinese manufactured filament' sold wholesale, alongside a note that the wholesale program was discontinued after 2017-2018 supply issues; whether that remains current is unverified. Also sells 3D printer resin. Instagram and Facebook entries were assembled from the handles @hatchbox3d and HATCHBOX3D cited in research rather than from links captured directly. No build plates or print surfaces were found, but this is an unverified negative so makes_plates is left unset.",
  "provenance": {
    "sources": [
      "https://www.hatchbox3d.com/pages/about-us",
      "https://www.hatchbox3d.com/collections/usa-made",
      "https://www.hatchbox3d.com/products/3d-pla-1kg1-75-blk",
      "https://www.printedsolid.com/blogs/news/a-note-concerning-availability-of-hatchbox",
      "https://trademarks.justia.com/owners/hatchbox-inc-4052954",
      "https://www.hatchbox3d.com/collections/all-filaments",
      "https://cdn.shopify.com/s/files/1/0008/2457/4018/files/HATCHBOX_PLA_3D_Printer_Filament_SDS.pdf?1561",
      "https://cdn.shopify.com/s/files/1/0008/2457/4018/files/HATCHBOX_ABS_3D_Printer_Filament_SDS.pdf?1561",
      "https://cdn.shopify.com/s/files/1/0008/2457/4018/files/HATCHBOX_PETG_3D_Printer_Filament_SDS.pdf?1561",
      "https://cdn.shopify.com/s/files/1/0008/2457/4018/files/HATCHBOX_TPU_3D_Printer_Filament_SDS.pdf?1561",
      "https://www.hatchbox3d.com/products/3d-pla-1kg1-75-carbon",
      "https://www.hatchbox3d.com/products/3d-wood-1kg1-75",
      "https://www.hatchbox3d.com/products/3d-tpu-1kg1-75-blk",
      "https://www.amazon.com/HATCHBOX-Printer-Filament-Diameter-Printing/dp/B0CXZYGYLN",
      "https://www.amazon.com/HATCHBOX-Metallic-Filament-Dimensional-Accuracy/dp/B09T98ZJPQ",
      "https://filamentcheatsheet.com/database/brand/hatchbox/"
    ],
    "last_verified": "2026-07-31",
    "confidence": "low",
    "conflicts": "Manufacturing origin is split and only partly evidenced: the 'China' entry comes from a single 2018 third-party retailer blog post, while 'United States' comes from Hatchbox's own PLA MAX marketing. No OEM factory is named by any source, and headquarters location is inferred rather than documented."
  }
}
