{
  "id": "iemai-3d",
  "name": "IEMAI 3D (Dongguan Imai Intelligent Technology Co., Ltd.)",
  "status": "researched",
  "summary": "Dongguan-based manufacturer established 2015 producing 3D printing materials and equipment for industrial sectors, and the parent OEM behind the iSanghu and iSanmate retail filament labels. Consumer output skews toward aesthetic and visual-effect filaments rather than production-grade engineering materials.",
  "headquarters_country": "China",
  "manufacturing_countries": [
    "China"
  ],
  "brands": [
    "IEMAI 3D",
    "iSanghu",
    "iSanmate",
    "Songhu Plastic"
  ],
  "oem_relationships": [
    {
      "company": "iSanghu",
      "relationship": "manufactures-for",
      "notes": "User-verified (research/verified-oem-relationships.md). iSanghu is a retail-facing label of IEMAI with no independent factory; recorded here rather than as its own entry."
    },
    {
      "company": "iSanmate",
      "relationship": "manufactures-for",
      "notes": "User-verified (research/verified-oem-relationships.md). iSanmate is a retail-facing label of IEMAI with no independent factory; recorded here rather than as its own entry."
    }
  ],
  "endpoints": {
    "website": "https://www.iemai3d.com/",
    "store": "https://www.isanmate.com/",
    "social": {
      "facebook": "https://www.facebook.com/iemai3d.china/",
      "linkedin": "https://www.linkedin.com/company/iemai-3d"
    }
  },
  "product_lines": [
    {
      "name": "PLA",
      "filament_ids": [
        "pla"
      ],
      "notes": "Standard PLA."
    },
    {
      "name": "CF-PLA",
      "filament_ids": [
        "pla-cf"
      ],
      "notes": "Carbon-fiber PLA."
    },
    {
      "name": "PETG / High Speed PETG",
      "filament_ids": [
        "petg"
      ],
      "notes": "Standard PETG plus a high-flow grade rated to 300 mm/s; catalog has no high-flow PETG id."
    },
    {
      "name": "CF-PETG",
      "filament_ids": [
        "petg-cf"
      ],
      "notes": "Carbon-fiber PETG."
    },
    {
      "name": "ABS",
      "filament_ids": [
        "abs"
      ],
      "notes": "Standard ABS."
    },
    {
      "name": "CF-ABS",
      "filament_ids": [],
      "notes": "Carbon-fiber ABS; catalog has abs-gf but no carbon-fiber ABS id."
    },
    {
      "name": "ESD-ABS",
      "filament_ids": [],
      "notes": "Static-dissipative ABS; catalog has petg-esd but no ABS ESD id."
    },
    {
      "name": "ASA",
      "filament_ids": [
        "asa"
      ],
      "notes": "Standard ASA."
    },
    {
      "name": "CF-ASA",
      "filament_ids": [
        "asa-cf"
      ],
      "notes": "Carbon-fiber ASA."
    },
    {
      "name": "PP",
      "filament_ids": [
        "pp"
      ],
      "notes": "Polypropylene."
    },
    {
      "name": "TPU",
      "filament_ids": [
        "tpu"
      ],
      "notes": "Flexible TPU; shore grade not stated in the catalog listing."
    },
    {
      "name": "PC",
      "filament_ids": [
        "pc"
      ],
      "notes": "Polycarbonate."
    },
    {
      "name": "CF-PC",
      "filament_ids": [],
      "notes": "Carbon-fiber polycarbonate; catalog has pc-gf (provisional) but no carbon-fiber PC id."
    },
    {
      "name": "PA12",
      "filament_ids": [
        "pa12"
      ],
      "notes": "Unfilled nylon 12."
    },
    {
      "name": "CF-PA12",
      "filament_ids": [
        "pa12-cf"
      ],
      "notes": "Carbon-fiber PA12."
    },
    {
      "name": "GF-PA12",
      "filament_ids": [],
      "notes": "Glass-fiber PA12; catalog has pa6-gf (provisional) and pa12-cf but no glass-fiber PA12 id."
    },
    {
      "name": "CF-PA6",
      "filament_ids": [
        "pa6-cf"
      ],
      "notes": "Carbon-fiber PA6."
    },
    {
      "name": "CF-PPA",
      "filament_ids": [
        "ppa-cf"
      ],
      "notes": "Carbon-fiber polyphthalamide, the high-temp nylon class Bambu markets as PAHT-CF."
    },
    {
      "name": "PPS",
      "filament_ids": [
        "pps"
      ],
      "notes": "Polyphenylene sulfide."
    },
    {
      "name": "CF-PPS",
      "filament_ids": [
        "pps-cf"
      ],
      "notes": "Carbon-fiber PPS."
    },
    {
      "name": "PEEK",
      "filament_ids": [
        "peek"
      ],
      "notes": "Unfilled polyether ether ketone."
    },
    {
      "name": "CF-PEEK",
      "filament_ids": [],
      "notes": "Carbon-fiber PEEK; catalog has peek but no filled PEEK grade ids."
    },
    {
      "name": "GF-PEEK",
      "filament_ids": [],
      "notes": "Glass-fiber PEEK; no filled PEEK grade id in catalog."
    },
    {
      "name": "PEKK",
      "filament_ids": [
        "pekk"
      ],
      "notes": "Polyetherketoneketone."
    },
    {
      "name": "PEI 9085 / PEI 1010 (ULTEM-class)",
      "filament_ids": [
        "pei-ultem"
      ],
      "notes": "Polyetherimide; both ULTEM-equivalent grades map to the single pei-ultem entry."
    },
    {
      "name": "PPSU",
      "filament_ids": [
        "ppsu"
      ],
      "notes": "Polyphenylsulfone."
    },
    {
      "name": "iSanghu (retail label)",
      "filament_ids": [
        "pla",
        "pla-hf",
        "pla-silk",
        "petg"
      ],
      "notes": "PLA, High-Speed PLA, Silk PLA, PETG and Transparent PETG; the line also includes an ABS-CF SKU for which no catalog id exists."
    },
    {
      "name": "iSanmate (retail label)",
      "filament_ids": [
        "pla",
        "pla-wood",
        "pla-silk",
        "pla-hf",
        "pla-gradient",
        "pla-cf",
        "pc"
      ],
      "notes": "Wood PLA, Rainbow PLA, Silk PLA, High-Speed PLA, PLA-CF and a translucent PC lamp-shade filament."
    }
  ],
  "price_tier": "budget",
  "additional_notes": "HQ and manufacturing at 2nd Floor, Building F, No.6 Hupan Road, Dalingshan Town, Dongguan, Guangdong. Chinese name 东莞一迈智能科技有限公司. Additional endpoints: iSanghu store https://www.isanghu3d.com/, secondary IEMAI Facebook https://www.facebook.com/iemai3dprinting/, iSanmate Facebook https://www.facebook.com/iSANMATE/. Company literature describes supplying 3D printing equipment and materials to aerospace, automotive, petrochemical, medical and electronics customers, implying industrial OEM work beyond consumer filament, though no specific industrial clients were verified. Pricing spans $14-22/kg for iSanghu (Tier C) and $18-28/kg for iSanmate aesthetic composites, so the single budget tier understates the iSanmate specialty range. iSanmate is described as CE/ISO certified, but reviewers note it prioritises visual effect over dimensional consistency — decorative/hobbyist rather than production-grade. Build plates: none found, so makes_plates is left unset.",
  "provenance": {
    "sources": [
      "https://craft.co/iemai-3d",
      "https://www.isanmate.com/about-us/",
      "https://filamentcheatsheet.com/brands/isanghu/",
      "https://filamentcheatsheet.com/brands/isanmate/",
      "/home/claude/filament-repo/research/verified-oem-relationships.md (project-owner verified)",
      "https://store.iemai3d.com/index.php/product/pla/",
      "https://store.iemai3d.com/index.php/product/petg/",
      "https://us.amazon.com/dp/B0GHDK5TJM",
      "https://www.iemai3d.com/index.php/3d-printing-filament/"
    ],
    "last_verified": "2026-07-31",
    "confidence": "medium",
    "conflicts": "The relationship between IEMAI and 'Songhu Plastic' is inferred only from a Facebook page titled 'IEMAI 3D & Songhu Plastic' and is unverified. Claimed industrial-sector OEM scope comes from company self-description with no named clients. A single price_tier cannot express the iSanghu (budget) vs iSanmate (specialty/mid) split. Endpoint corrected 2026-08-01: website https://store.iemai3d.com/ -> https://www.iemai3d.com/ (old host failed TLS with a certificate hostname mismatch; www.iemai3d.com verified as the live corporate site)."
  }
}
