{
  "id": "addnorth",
  "name": "add:north (Add North 3D AB)",
  "status": "researched",
  "summary": "Swedish filament brand based in Olsremma, marketing its range as 'Made in Sweden' with heavy Nordic-origin and sustainability positioning. Catalogue centres on named PLA grades (X-PLA, E-PLA), PETG including an Economy line, the Rigid X engineering grade, TPU and the Addlantis nylon line. Reviewed as a top-tier premium brand.",
  "headquarters_country": "Sweden",
  "manufacturing_countries": [
    "Sweden"
  ],
  "brands": [
    "add:north",
    "Addlantis"
  ],
  "endpoints": {
    "website": "https://addnorth.com/",
    "support": "https://addnorth.com/en/contact/",
    "social": {
      "facebook": "https://www.facebook.com/addnorth/",
      "instagram": "https://www.instagram.com/addnorth3d/",
      "linkedin": "https://www.linkedin.com/company/add-north"
    }
  },
  "product_lines": [
    {
      "name": "X-PLA",
      "filament_ids": [
        "pla"
      ],
      "notes": "Flagship general-purpose PLA, described as a 100% biodegradable PLA-mix, density 1.24-1.26"
    },
    {
      "name": "PLA Economy",
      "filament_ids": [
        "pla"
      ],
      "notes": "Budget 100% corn-based PLA"
    },
    {
      "name": "E-PLA",
      "filament_ids": [
        "pla"
      ],
      "notes": "Biodegradable PLA, density 1.23-1.25"
    },
    {
      "name": "PLA Wood",
      "filament_ids": [
        "pla-wood"
      ],
      "notes": "40% wood fibre + 60% bio-based PLA"
    },
    {
      "name": "Textura",
      "filament_ids": [
        "pla-matte"
      ],
      "notes": "Matte bio-based PLA with plant fibres, density 1.24-1.27; the plant-fibre filler has no dedicated id"
    },
    {
      "name": "PETG",
      "filament_ids": [
        "petg"
      ],
      "notes": "Standard PETG, density 1.27"
    },
    {
      "name": "PETG Economy",
      "filament_ids": [
        "petg"
      ],
      "notes": "Budget PETG"
    },
    {
      "name": "PETG Pro Series Matte",
      "filament_ids": [
        "petg"
      ],
      "notes": "Matte PETG, density 1.3; no petg-matte id exists"
    },
    {
      "name": "ESD PETG",
      "filament_ids": [
        "petg-esd"
      ],
      "notes": "Conductive PETG, target surface resistivity 1e6-1e9 ohm-cm"
    },
    {
      "name": "Rigid X",
      "filament_ids": [
        "petg-cf"
      ],
      "notes": "Carbon-fibre-reinforced PETG, density 1.3, working temperature 90 C - corrects the earlier PLA assumption"
    },
    {
      "name": "EasyFlex",
      "filament_ids": [
        "tpu-95a"
      ],
      "notes": "TPU, Shore 95A"
    },
    {
      "name": "rABS",
      "filament_ids": [
        "abs"
      ],
      "notes": "100% recycled ABS, density 1.03-1.05"
    },
    {
      "name": "OBC Polyethylene",
      "filament_ids": [],
      "notes": "Engineering-grade polyethylene, chemically an olefin block copolymer, density 0.905; no polyethylene/OBC id exists"
    },
    {
      "name": "Adura",
      "filament_ids": [
        "copa"
      ],
      "notes": "Copolyamide nylon (Addlantis family), density 1.1, HDT 0.45 MPa 105 C, tensile 50 MPa; exact copolyamide type unspecified so the generic pa id is used Remapped pa→copa (copolyamide) 2026-08-01."
    },
    {
      "name": "Adura FDA",
      "filament_ids": [
        "copa"
      ],
      "notes": "FDA-compliant copolyamide variant Remapped pa→copa (copolyamide) 2026-08-01."
    },
    {
      "name": "Adura X",
      "filament_ids": [],
      "notes": "Carbon-fibre-reinforced copolyamide; no generic pa-cf id exists and the copolyamide type is unspecified"
    },
    {
      "name": "Addbor N25",
      "filament_ids": [],
      "notes": "Copolyamide + 25 wt% boron carbide, density 1.3, for neutron shielding/wear resistance; no equivalent id"
    },
    {
      "name": "Adamant S1",
      "filament_ids": [],
      "notes": "100% PVDF fluoropolymer, density 1.8, UL94 V-0; no PVDF id exists"
    },
    {
      "name": "Koltron G1",
      "filament_ids": [],
      "notes": "Graphene-enhanced electrically/thermally conductive compound, density 1.76, volume resistivity ~2.0 ohm-cm; base polymer undisclosed"
    }
  ],
  "makes_plates": false,
  "price_tier": "premium",
  "additional_notes": "Registered address: Add North 3D AB, Ulricehamnsvagen 11, 514 62 Olsremma, Sweden. Locale variants of the site exist (e.g. https://addnorth.fi/rnd). The YouTube presence was seen only as individual videos (e.g. https://www.youtube.com/watch?v=5m4icGgBdyk) with no confirmed channel URL, so it is not recorded in endpoints.social. Rated Tier A (top tier) by Filament Cheat Sheet and generally priced above the Polish volume brands, though no verified $/kg figure was found. No build plates or print surfaces found.",
  "provenance": {
    "sources": [
      "https://addnorth.com/en/contact/",
      "https://addnorth.com/shop",
      "https://filamentcheatsheet.com/brands/add_north/",
      "https://www.youtube.com/watch?v=5m4icGgBdyk",
      "https://filament2print.com/en/brand/62-addnorth",
      "https://storage.googleapis.com/addnorth-com-public/catalog/addnorth_product_catalogue_2022.pdf",
      "https://storage.googleapis.com/addnorth-com.appspot.com/imgix/assets/production/Adura_TDS_KRM71m.pdf",
      "https://filamentworld.de/fact-sheets/AddNorth_Adura-FDA_Datenblatt_EN.pdf"
    ],
    "last_verified": "2026-07-31",
    "confidence": "medium",
    "conflicts": "The 'Made in Sweden' claim comes from the brand's own marketing; no direct statement of owned extrusion capacity was found, so manufacturing_countries rests on marketing rather than a primary facility source. No OEM counterparty could be named, so oem_relationships is omitted. The base polymer of Rigid X is unconfirmed and its filament_ids entry is a guess. Endpoint corrected 2026-08-01: store https://addnorth.com/shop -> removed (returns HTTP 404, as do /shop/, /en/shop/, /custom-filaments and other catalogue paths; the site root and /en/contact/ still load, but no live add:north webshop path could be verified, so the field is dropped rather than pointed at a dead or guessed URL)."
  }
}
